Place,Description,Activities,Best Months to Visit,Time to Cover,Estimated Expenses per person (INR)
Agra,"Home to the iconic Taj Mahal, a UNESCO World Heritage Site.","Exploring the Taj Mahal, Agra Fort, Fatehpur Sikri, Itmad-ud-Daulah's Tomb, Mughal Gardens, shopping for souvenirs.",October - March,2-3 days,"3,000 - 8,000"
Varanasi (Kashi),"Holy city on the banks of the Ganges River, known for its spiritual significance and vibrant culture.","Taking a boat ride on the Ganges, witnessing sunrise and aarti ceremony, exploring temples like Kashi Vishwanath Temple and Sankat Mochan Hanuman Temple, experiencing traditional rituals.",October - February,2-3 days,"2,000 - 6,000"
Mathura,"Birthplace of Lord Krishna, known for its numerous temples and historical sites.","Visiting Krishna Janmabhoomi Temple, Dwarkadheesh Temple, Gita Mandiram, attending cultural events, exploring museums.",October - March,1-2 days,"2,000 - 5,000"
Ayodhya,Birthplace of Lord Rama and a key pilgrimage site for Hindus.,"Visiting Ram Janmabhoomi Temple, Hanumangarhi Temple, Kanak Bhavan, witnessing aarti ceremony, exploring historical sites.",October - March,1-2 days,"1,500 - 4,000"
Sarnath,Buddhist pilgrimage site where Lord Buddha delivered his first sermon.,"Visiting Dhamek Stupa, Chaukhandi Stupa, Deer Park, Archaeological Museum, witnessing Buddhist ceremonies.",October - March,1 day,"1,000 - 3,000"
Kushinagar,Site of Lord Buddha's Parinirvana (attainment of Nirvana).,"Visiting Mahaparinirvana Stupa, Paranirvana Temple, Japanese Buddhist Temple, witnessing Buddhist rituals.",October - March,1 day,"1,000 - 3,000"
Lucknow,"Capital city of Uttar Pradesh, known for its rich cultural heritage and architectural marvels.","Exploring Bara Imambara, Chota Imambara, Residency Complex, Lucknow Zoo, witnessing Chikan embroidery demonstrations.",October - March,2-3 days,"2,500 - 7,000"
Kanpur,Industrial and historical city known for its museums and colonial architecture.,"Visiting Kanpur Memorial, Allen Forest Zoo, Kanpur Zoological Garden, exploring museums like the National Sangeet Natak Akademi Museum.",October - March,1-2 days,"2,000 - 5,000"
Hastinapur,"Ancient city mentioned in the Mahabharata, known for its historical significance.","Visiting Jain temples, archaeological sites, Hastinapur Wildlife Sanctuary, witnessing cultural performances.",October - March,1 day,"1,000 - 3,000"
Jhansi,"City known for its association with Rani Lakshmibai, a symbol of Indian independence.","Visiting Jhansi Fort, Rani Mahal, Government Museum, witnessing light and sound show at Jhansi Fort.",October - March,1 day,"1,000 - 3,000"