Place,Description,Activities,Best Months to Visit,Time to Cover,Estimated Expenses per person (INR)
Chennai,"Capital city with historical landmarks, beaches, and cultural experiences.","Fort St. George, Marina Beach, Kapaleeshwarar Temple, museums, art galleries, Bharatanatyam dance performances.",October - March,2-3 days,"3,000 - 8,000"
Madurai,Temple city known for its magnificent Meenakshi Amman Temple and rich cultural heritage.,"Meenakshi Amman Temple, Thirumalai Nayak Mahal, Alagar Kovil Temple, sound and light show, exploring bazaars.",October - February,2-3 days,"2,500 - 7,000"
Kanyakumari (Cape Comorin),"Southernmost tip of India, known for its stunning sunrise and sunset views.","Vivekananda Rock Memorial, Kanyakumari Beach, Thanumalayan Temple, Padmanabhapuram Palace, boat rides.",October - March,1-2 days,"2,000 - 5,000"
Ooty (Udagamandalam),"Hill station offering scenic beauty, colonial architecture, and cool climate.","Toy train ride, boating on Ooty Lake, Doddabetta Peak, Botanical Garden, exploring tea plantations.","March - May, September - November",2-3 days,"4,000 - 10,000"
Kodaikanal,"Picturesque hill station known for its waterfalls, lakes, and trekking trails.","Trekking to Dolphin's Nose and Bear Shola Falls, boating on Kodai Lake, Bryant Park, Guna Caves, Pillar Rocks.",November - February,2-3 days,"4,000 - 10,000"
Mahabalipuram (Mamallapuram),UNESCO World Heritage Site known for its ancient temples and rock-cut sculptures.,"Shore Temple, Five Rathas, Arjuna's Penance, Krishna's Butterball, Crocodile Bank.",October - March,1-2 days,"2,000 - 5,000"
Thanjavur (Tanjore),Cultural center known for its magnificent Brihadeeswarar Temple and bronze sculptures.,"Brihadeeswarar Temple, Thanjavur Maratha Palace, Saraswathi Mahal Library, Art Gallery, exploring local markets.",October - March,1-2 days,"2,000 - 5,000"
Rameshwaram,Island town famous for its Ramanathaswamy Temple and holy significance.,"Ramanathaswamy Temple, Dhanushkodi Beach, Pamban Bridge, witnessing sunrise/sunset, boat rides.",October - March,1-2 days,"2,000 - 5,000"
Kanchipuram,Temple town known for its silk sarees and numerous ancient temples.,"Ekambareswarar Temple, Kamakshi Amman Temple, Kanchi Kudil, Kanchipuram Silk Saree shopping.",October - March,1 day,"1,500 - 4,000"
Yelagiri,"Hill station offering a peaceful escape with trekking, boating, and adventure activities.","Trekking, boating on Punganoor Lake, Yelagiri Mountain Bike Challenge, paragliding, spelunking.",October - March,1-2 days,"2,000 - 5,000"